<?xml version="1.0" encoding="UTF-8"?>
<tns:fileSystem 
xmlns:tns="http://www.example.org/e04" 
xmlns:xsi="http://www.w3.org/2001/XMLSchema-instance" 
xsi:schemaLocation="http://www.example.org/e04 e04.xsd ">
	<tns:dir>
		<tns:dir></tns:dir>
		<tns:dir></tns:dir>
		<tns:dir></tns:dir>
		<tns:dir></tns:dir>
		<tns:dir></tns:dir>
		<tns:file/>
		<tns:file/>
		<tns:file/>
		<tns:file/>
	</tns:dir>
	<tns:dir></tns:dir>
	<tns:dir></tns:dir>
	<tns:dir></tns:dir>
	<tns:dir></tns:dir>
	<tns:dir></tns:dir>
	<tns:file/>
	<tns:file/>
	<tns:file/>
	<tns:file/>
</tns:fileSystem>
